{
  "schema_version": 2,
  "bank_id": "std1.figure-gallery",
  "version": 1,
  "source": "M5 FigureView kit (#16): the canonical figure-spec examples — one served item per figure kind plus the deliberate prose fallback. Authored to docs/curriculum/standard-1-sjkc-math.md (scope) and standard-1-question-style.md (formats/distractors); executed by shared/tests/figures.test.ts.",
  "currency": "RM",
  "profile": "dpk3_2026_core",
  "scope": "Figure DSL gallery: ten-frame, clock, coins, objects, and the figure:pictograph prose fallback. Content spans §4.1–§4.4 and §4.7 at TP1–TP2 so every figure kind is exercised; not area-routed — the topic arcs (#17–#19) author the real area banks.",
  "questions": [
    {
      "id": 1,
      "topic": "4.1",
      "tp_level": 1,
      "profile": "dpk3_2026_core",
      "item_format": "objective",
      "format_type": "count-write",
      "presentation": "figure:objects",
      "answer_form": "count",
      "answer_unit": "none",
      "operation": "counting",
      "expression": "8",
      "answer": 8,
      "bilingual": { "numeral": "8", "zh_word": "八" },
      "question_zh": "数一数，羊圈里共有几只羊？",
      "question_en": "Count the sheep in the pen. How many are there?",
      "figure": { "kind": "objects", "icon": "🐑", "count": 8 },
      "distractors": [
        { "value": 6, "strategy": "off-by-one-count" },
        { "value": 7, "strategy": "off-by-one-count" },
        { "value": 9, "strategy": "off-by-one-count" }
      ]
    },
    {
      "id": 2,
      "topic": "4.2",
      "tp_level": 2,
      "profile": "dpk3_2026_core",
      "item_format": "objective",
      "format_type": "picture-sentence",
      "presentation": "figure:objects",
      "answer_form": "numeral",
      "answer_unit": "none",
      "operation": "subtraction",
      "expression": "12 - 5",
      "answer": 7,
      "bilingual": { "numeral": "7", "zh_word": "七" },
      "question_zh": "树上有 12 个苹果，划掉 5 个，还剩几个？",
      "question_en": "There are 12 apples on the tree. Cross out 5. How many are left?",
      "figure": { "kind": "objects", "icon": "🍎", "count": 12, "crossedOut": 5 },
      "distractors": [
        { "value": 6, "strategy": "off-by-one-count" },
        { "value": 17, "strategy": "wrong-operation" },
        { "value": 5, "strategy": "raw-operand" }
      ]
    },
    {
      "id": 3,
      "topic": "4.1",
      "tp_level": 2,
      "profile": "dpk3_2026_core",
      "item_format": "objective",
      "format_type": "number-bond",
      "presentation": "figure:ten-frame",
      "answer_form": "numeral",
      "answer_unit": "none",
      "operation": "subtraction",
      "expression": "10 - 7",
      "answer": 3,
      "bilingual": { "numeral": "3", "zh_word": "三" },
      "question_zh": "羊圈里有 7 只羊，再进几只就满 10 只？",
      "question_en": "There are 7 sheep in the pen. How many more make 10?",
      "figure": { "kind": "ten-frame", "filled": 7 },
      "distractors": [
        { "value": 4, "strategy": "off-by-one-count" },
        { "value": 7, "strategy": "raw-operand" },
        { "value": 10, "strategy": "count-all-vs-add" }
      ]
    },
    {
      "id": 4,
      "topic": "4.1",
      "tp_level": 2,
      "profile": "dpk3_2026_core",
      "item_format": "objective",
      "format_type": "number-bond",
      "presentation": "figure:ten-frame",
      "answer_form": "numeral",
      "answer_unit": "none",
      "operation": "subtraction",
      "expression": "20 - 13",
      "answer": 7,
      "bilingual": { "numeral": "7", "zh_word": "七" },
      "question_zh": "两个羊圈里有 13 只羊，再进几只就满 20 只？",
      "question_en": "Two pens hold 13 sheep. How many more make 20?",
      "figure": { "kind": "ten-frame", "filled": 13 },
      "distractors": [
        { "value": 6, "strategy": "off-by-one-count" },
        { "value": 13, "strategy": "raw-operand" },
        { "value": 10, "strategy": "place-value-slip" }
      ]
    },
    {
      "id": 5,
      "topic": "4.4",
      "tp_level": 1,
      "profile": "dpk3_2026_core",
      "item_format": "objective",
      "format_type": "read-instrument",
      "presentation": "figure:clock",
      "answer_form": "numeral",
      "answer_unit": "none",
      "operation": "counting",
      "expression": "3",
      "answer": 3,
      "bilingual": { "numeral": "3", "zh_word": "三" },
      "question_zh": "钟面上是几时？",
      "question_en": "What time is shown on the clock face?",
      "figure": { "kind": "clock", "hour": 3, "minute": 0 },
      "distractors": [
        { "value": 2, "strategy": "off-by-one-count" },
        { "value": 4, "strategy": "off-by-one-count" },
        { "value": 12, "strategy": "clock-hand-swap" }
      ]
    },
    {
      "id": 6,
      "topic": "4.4",
      "tp_level": 1,
      "profile": "dpk3_2026_core",
      "item_format": "objective",
      "format_type": "read-instrument",
      "presentation": "figure:clock",
      "answer_form": "numeral",
      "answer_unit": "none",
      "operation": "counting",
      "expression": "8",
      "answer": 8,
      "bilingual": { "numeral": "8", "zh_word": "八" },
      "question_zh": "猫头鹰管理员八时起床。钟面上是几时？",
      "question_en": "The owl keeper wakes at eight. What time is shown?",
      "figure": { "kind": "clock", "hour": 8, "minute": 0 },
      "distractors": [
        { "value": 7, "strategy": "off-by-one-count" },
        { "value": 9, "strategy": "off-by-one-count" },
        { "value": 12, "strategy": "clock-hand-swap" }
      ]
    },
    {
      "id": 7,
      "topic": "4.3",
      "tp_level": 2,
      "profile": "dpk3_2026_core",
      "item_format": "objective",
      "format_type": "count-write",
      "presentation": "figure:coins",
      "answer_form": "numeral",
      "answer_unit": "sen",
      "operation": "addition",
      "expression": "50 + 20 + 10",
      "answer": 80,
      "bilingual": { "numeral": "80", "zh_word": "八十" },
      "question_zh": "这些硬币共有多少？",
      "question_en": "How much do these coins make in total?",
      "figure": { "kind": "coins", "coins": [50, 20, 10] },
      "distractors": [
        { "value": 70, "strategy": "money-denom-miscount" },
        { "value": 90, "strategy": "money-denom-miscount" },
        { "value": 60, "strategy": "money-denom-miscount" }
      ]
    },
    {
      "id": 8,
      "topic": "4.3",
      "tp_level": 2,
      "profile": "dpk3_2026_core",
      "item_format": "objective",
      "format_type": "count-write",
      "presentation": "figure:coins",
      "answer_form": "numeral",
      "answer_unit": "sen",
      "operation": "addition",
      "expression": "20 + 20 + 5 + 5",
      "answer": 50,
      "bilingual": { "numeral": "50", "zh_word": "五十" },
      "question_zh": "水果摊上的硬币共有多少？",
      "question_en": "How much do the coins at the fruit stand make in total?",
      "figure": { "kind": "coins", "coins": [20, 20, 5, 5] },
      "distractors": [
        { "value": 45, "strategy": "money-denom-miscount" },
        { "value": 55, "strategy": "money-denom-miscount" },
        { "value": 40, "strategy": "money-denom-miscount" }
      ]
    },
    {
      "id": 9,
      "topic": "4.7",
      "tp_level": 2,
      "profile": "dpk3_2026_core",
      "item_format": "objective",
      "format_type": "read-instrument",
      "presentation": "figure:pictograph",
      "answer_form": "numeral",
      "answer_unit": "none",
      "operation": "subtraction",
      "expression": "5 - 3",
      "answer": 2,
      "bilingual": { "numeral": "2", "zh_word": "二" },
      "question_zh": "收获节展板上：苹果 5 篮，南瓜 3 篮。苹果比南瓜多几篮？",
      "question_en": "The harvest board shows 5 baskets of apples and 3 of pumpkins. How many more baskets of apples than pumpkins?",
      "distractors": [
        { "value": 1, "strategy": "off-by-one-count" },
        { "value": 3, "strategy": "off-by-one-count" },
        { "value": 8, "strategy": "wrong-operation" }
      ]
    }
  ]
}
